mysql> show databases
    -> show databases;
ERROR 1064 (42000): You have an error in your SQL syntax; check the manual that corresponds to your MySQL server version for the right syntax to use near 'show databases' at line 2
mysql> show databases;
+--------------------+
| Database           |
+--------------------+
| food               |
| iiitnuzvid         |
| iiitrkvalley       |
| iiitsklm           |
| information_schema |
| mysql              |
| nuzvid             |
| performance_schema |
| rgukt              |
| sakila             |
| sys                |
+--------------------+
11 rows in set (0.07 sec)

mysql> select *from rgukt;
ERROR 1046 (3D000): No database selected
mysql> use rgukt;
Database changed
mysql> select *from rgukt;
ERROR 1146 (42S02): Table 'rgukt.rgukt' doesn't exist
mysql> select *from students;
+-----+----------+-----------------+-----+
| id  | LastName | FirstName       | Age |
+-----+----------+-----------------+-----+
| 545 | KOLLI    | SWATHI          |  20 |
| 570 | MUNGARA  | SURYA PRASANTHI |  21 |
| 743 | ULAVALA  | GOPIKA          |  32 |
| 814 |          | RAJARAJESWARI   |  18 |
| 879 |          | SAI DURGA       |  19 |
| 929 | BEZAWADA | DIVYA           |  22 |
+-----+----------+-----------------+-----+
6 rows in set (0.00 sec)

mysql> desc students;
+-----------+--------------+------+-----+---------+-------+
| Field     | Type         | Null | Key | Default | Extra |
+-----------+--------------+------+-----+---------+-------+
| id        | int(11)      | NO   | PRI | NULL    |       |
| LastName  | varchar(100) | NO   |     | NULL    |       |
| FirstName | varchar(100) | NO   |     | NULL    |       |
| Age       | int(11)      | NO   |     | NULL    |       |
+-----------+--------------+------+-----+---------+-------+
4 rows in set (0.01 sec)

mysql>  select *from results;
ERROR 1146 (42S02): Table 'rgukt.results' doesn't exist
mysql>  select *from result;
ERROR 1146 (42S02): Table 'rgukt.result' doesn't exist
mysql> desc result;
ERROR 1146 (42S02): Table 'rgukt.result' doesn't exist
mysql> desc resultS;
ERROR 1146 (42S02): Table 'rgukt.results' doesn't exist
mysql> select *from parents;
+-----+----------+-----------+------+
| pid | Lastname | Firstname | Age  |
+-----+----------+-----------+------+
|   1 | DURGA    | ADDANKI   |   30 |
|   2 | BHAVANI  | BASAVANI  |   31 |
|   3 | BHargavi | BASIna    |   32 |
+-----+----------+-----------+------+
3 rows in set (0.00 sec)

mysql> desc parents;
+-----------+--------------+------+-----+---------+-------+
| Field     | Type         | Null | Key | Default | Extra |
+-----------+--------------+------+-----+---------+-------+
| pid       | int(11)      | NO   | PRI | NULL    |       |
| Lastname  | varchar(100) | NO   |     | NULL    |       |
| Firstname | varchar(100) | YES  |     | NULL    |       |
| Age       | int(11)      | YES  | UNI | NULL    |       |
+-----------+--------------+------+-----+---------+-------+
4 rows in set (0.00 sec)

mysql> update students set LastName='ADDANKI' where Age=18;
Query OK, 1 row affected (0.13 sec)
Rows matched: 1  Changed: 1  Warnings: 0

mysql> update students set LastName='T' where Age=19;
Query OK, 1 row affected (0.10 sec)
Rows matched: 1  Changed: 1  Warnings: 0

mysql> select *from students;
+-----+----------+-----------------+-----+
| id  | LastName | FirstName       | Age |
+-----+----------+-----------------+-----+
| 545 | KOLLI    | SWATHI          |  20 |
| 570 | MUNGARA  | SURYA PRASANTHI |  21 |
| 743 | ULAVALA  | GOPIKA          |  32 |
| 814 | ADDANKI  | RAJARAJESWARI   |  18 |
| 879 | T        | SAI DURGA       |  19 |
| 929 | BEZAWADA | DIVYA           |  22 |
+-----+----------+-----------------+-----+
6 rows in set (0.00 sec)

mysql> alter table students add foriegn key (pid) references parents(pid);
ERROR 1064 (42000): You have an error in your SQL syntax; check the manual that corresponds to your MySQL server version for the right syntax to use near 'key (pid) references parents(pid)' at line 1
mysql> alter table students add foreign key (pid) references parents(pid);
ERROR 1072 (42000): Key column 'pid' doesn't exist in table
mysql> select *from students;
+-----+----------+-----------------+-----+
| id  | LastName | FirstName       | Age |
+-----+----------+-----------------+-----+
| 545 | KOLLI    | SWATHI          |  20 |
| 570 | MUNGARA  | SURYA PRASANTHI |  21 |
| 743 | ULAVALA  | GOPIKA          |  32 |
| 814 | ADDANKI  | RAJARAJESWARI   |  18 |
| 879 | T        | SAI DURGA       |  19 |
| 929 | BEZAWADA | DIVYA           |  22 |
+-----+----------+-----------------+-----+
6 rows in set (0.00 sec)

mysql> alter table students add foreign key (pid) references parents(pid);
ERROR 1072 (42000): Key column 'pid' doesn't exist in table
mysql> alter table students add foreign key(pid) references parents(pid);
ERROR 1072 (42000): Key column 'pid' doesn't exist in table
mysql> select *from parents;
+-----+----------+-----------+------+
| pid | Lastname | Firstname | Age  |
+-----+----------+-----------+------+
|   1 | DURGA    | ADDANKI   |   30 |
|   2 | BHAVANI  | BASAVANI  |   31 |
|   3 | BHargavi | BASIna    |   32 |
+-----+----------+-----------+------+
3 rows in set (0.00 sec)

mysql> desc parents;
+-----------+--------------+------+-----+---------+-------+
| Field     | Type         | Null | Key | Default | Extra |
+-----------+--------------+------+-----+---------+-------+
| pid       | int(11)      | NO   | PRI | NULL    |       |
| Lastname  | varchar(100) | NO   |     | NULL    |       |
| Firstname | varchar(100) | YES  |     | NULL    |       |
| Age       | int(11)      | YES  | UNI | NULL    |       |
+-----------+--------------+------+-----+---------+-------+
4 rows in set (0.00 sec)

mysql> alter table students add foreign key (pid) references parents(pid);
ERROR 1072 (42000): Key column 'pid' doesn't exist in table
mysql> alter table students add foreign key (pid) references parents(pid);
ERROR 1072 (42000): Key column 'pid' doesn't exist in table
mysql> alter table students
    -> add foreign key (pid) references
    -> parents(pid);
ERROR 1072 (42000): Key column 'pid' doesn't exist in table
mysql> alter table students
    -> add constraint fk_parents
    -> foreign key (pid) references
    -> parents(pid);
ERROR 1072 (42000): Key column 'pid' doesn't exist in table
mysql> select *students;
ERROR 1064 (42000): You have an error in your SQL syntax; check the manual that corresponds to your MySQL server version for the right syntax to use near 'students' at line 1
mysql> select *fromstudents;
ERROR 1064 (42000): You have an error in your SQL syntax; check the manual that corresponds to your MySQL server version for the right syntax to use near 'fromstudents' at line 1
mysql> select *fromstudents;
ERROR 1064 (42000): You have an error in your SQL syntax; check the manual that corresponds to your MySQL server version for the right syntax to use near 'fromstudents' at line 1
mysql> select *from students;
+-----+----------+-----------------+-----+
| id  | LastName | FirstName       | Age |
+-----+----------+-----------------+-----+
| 545 | KOLLI    | SWATHI          |  20 |
| 570 | MUNGARA  | SURYA PRASANTHI |  21 |
| 743 | ULAVALA  | GOPIKA          |  32 |
| 814 | ADDANKI  | RAJARAJESWARI   |  18 |
| 879 | T        | SAI DURGA       |  19 |
| 929 | BEZAWADA | DIVYA           |  22 |
+-----+----------+-----------------+-----+
6 rows in set (0.00 sec)

mysql> alter students
    -> add column pid;
ERROR 1064 (42000): You have an error in your SQL syntax; check the manual that corresponds to your MySQL server version for the right syntax to use near 'students
add column pid' at line 1
mysql> select *from students;
+-----+----------+-----------------+-----+
| id  | LastName | FirstName       | Age |
+-----+----------+-----------------+-----+
| 545 | KOLLI    | SWATHI          |  20 |
| 570 | MUNGARA  | SURYA PRASANTHI |  21 |
| 743 | ULAVALA  | GOPIKA          |  32 |
| 814 | ADDANKI  | RAJARAJESWARI   |  18 |
| 879 | T        | SAI DURGA       |  19 |
| 929 | BEZAWADA | DIVYA           |  22 |
+-----+----------+-----------------+-----+
6 rows in set (0.00 sec)

mysql> alter table students
    -> add pid int;
Query OK, 0 rows affected (0.80 sec)
Records: 0  Duplicates: 0  Warnings: 0

mysql> update students set pid=2 where age=19;
Query OK, 1 row affected (0.15 sec)
Rows matched: 1  Changed: 1  Warnings: 0

mysql> update students set pid=1 where age=18;
Query OK, 1 row affected (0.09 sec)
Rows matched: 1  Changed: 1  Warnings: 0

mysql> update students set pid=2 where age=20;
Query OK, 1 row affected (0.09 sec)
Rows matched: 1  Changed: 1  Warnings: 0

mysql> update students set pid=2 where age=21;
Query OK, 1 row affected (0.10 sec)
Rows matched: 1  Changed: 1  Warnings: 0

mysql> update students set pid=3 where age=22;
Query OK, 1 row affected (0.05 sec)
Rows matched: 1  Changed: 1  Warnings: 0

mysql> update students set pid=3 where age=32;
Query OK, 1 row affected (0.07 sec)
Rows matched: 1  Changed: 1  Warnings: 0

mysql> select *from students;
+-----+----------+-----------------+-----+------+
| id  | LastName | FirstName       | Age | pid  |
+-----+----------+-----------------+-----+------+
| 545 | KOLLI    | SWATHI          |  20 |    2 |
| 570 | MUNGARA  | SURYA PRASANTHI |  21 |    2 |
| 743 | ULAVALA  | GOPIKA          |  32 |    3 |
| 814 | ADDANKI  | RAJARAJESWARI   |  18 |    1 |
| 879 | T        | SAI DURGA       |  19 |    2 |
| 929 | BEZAWADA | DIVYA           |  22 |    3 |
+-----+----------+-----------------+-----+------+
6 rows in set (0.00 sec)

mysql> alter table students
    -> add foreign key (pid) references
    -> parents(pid);
Query OK, 6 rows affected (1.79 sec)
Records: 6  Duplicates: 0  Warnings: 0

mysql> select *from students;
+-----+----------+-----------------+-----+------+
| id  | LastName | FirstName       | Age | pid  |
+-----+----------+-----------------+-----+------+
| 545 | KOLLI    | SWATHI          |  20 |    2 |
| 570 | MUNGARA  | SURYA PRASANTHI |  21 |    2 |
| 743 | ULAVALA  | GOPIKA          |  32 |    3 |
| 814 | ADDANKI  | RAJARAJESWARI   |  18 |    1 |
| 879 | T        | SAI DURGA       |  19 |    2 |
| 929 | BEZAWADA | DIVYA           |  22 |    3 |
+-----+----------+-----------------+-----+------+
6 rows in set (0.00 sec)

mysql> desc students;
+-----------+--------------+------+-----+---------+-------+
| Field     | Type         | Null | Key | Default | Extra |
+-----------+--------------+------+-----+---------+-------+
| id        | int(11)      | NO   | PRI | NULL    |       |
| LastName  | varchar(100) | NO   |     | NULL    |       |
| FirstName | varchar(100) | NO   |     | NULL    |       |
| Age       | int(11)      | NO   |     | NULL    |       |
| pid       | int(11)      | YES  | MUL | NULL    |       |
+-----------+--------------+------+-----+---------+-------+
5 rows in set (0.00 sec)

mysql> Terminal close -- exit!
